{
    "reasons":  [

                ],
    "steamclient_sha256":  "e9045710ec7ee47d7b7488d1c5dda2d933dec7e251e965967a5c48f4df68eb4e",
    "schema":  1,
    "tool":  "cr_compat_check/0.1",
    "fields":  {
                   "getUserStatsDesc":  {
                                            "ok":  true,
                                            "kind":  "descriptor",
                                            "critical":  false
                                        },
                   "image":  {
                                 "ok":  true,
                                 "kind":  "pe",
                                 "critical":  true
                             },
                   "releaseWrapped":  {
                                          "ok":  true,
                                          "kind":  "func",
                                          "critical":  true
                                      },
                   "ccmInterfaceVtable":  {
                                              "ok":  true,
                                              "kind":  "vtable",
                                              "critical":  true
                                          },
                   "serviceTransportVtable":  {
                                                  "ok":  true,
                                                  "kind":  "vtable",
                                                  "critical":  true
                                              },
                   "globalEngine":  {
                                        "ok":  true,
                                        "kind":  "global",
                                        "critical":  true
                                    },
                   "bRouteMsgToJob":  {
                                          "ok":  true,
                                          "kind":  "func",
                                          "critical":  true
                                      },
                   "wrapPacket":  {
                                      "ok":  true,
                                      "kind":  "func",
                                      "critical":  true
                                  },
                   "bAsyncSend":  {
                                      "ok":  true,
                                      "kind":  "func",
                                      "critical":  false
                                  },
                   "parseFromArray":  {
                                          "ok":  true,
                                          "kind":  "func",
                                          "critical":  true
                                      },
                   "getUserStatsVtable":  {
                                              "ok":  true,
                                              "kind":  "vtable",
                                              "critical":  false
                                          },
                   "serializeToArray":  {
                                            "ok":  true,
                                            "kind":  "func",
                                            "critical":  true
                                        },
                   "refCountHelper":  {
                                          "ok":  true,
                                          "kind":  "func",
                                          "critical":  true
                                      },
                   "kvSetString":  {
                                       "ok":  true,
                                       "kind":  "func",
                                       "critical":  false
                                   },
                   "findJob":  {
                                   "ok":  true,
                                   "kind":  "func",
                                   "critical":  true
                               },
                   "engineOffsets":  {
                                         "ok":  true,
                                         "kind":  "offset",
                                         "critical":  true
                                     },
                   "pbMsgCtor":  {
                                     "ok":  true,
                                     "kind":  "func",
                                     "critical":  false
                                 },
                   "accountIdOffset":  {
                                           "ok":  true,
                                           "kind":  "offset",
                                           "critical":  true,
                                           "detail":  "522"
                                       },
                   "respDescriptor":  {
                                          "ok":  true,
                                          "kind":  "descriptor",
                                          "critical":  false
                                      },
                   "getAppInfo":  {
                                      "ok":  true,
                                      "kind":  "func",
                                      "critical":  false
                                  },
                   "messageLayout":  {
                                         "ok":  true,
                                         "kind":  "offset",
                                         "critical":  true,
                                         "detail":  "header/body verified"
                                     },
                   "regKeySyncTime":  {
                                          "ok":  true,
                                          "kind":  "global",
                                          "critical":  false
                                      },
                   "buildDepotDependency":  {
                                                "ok":  true,
                                                "kind":  "func",
                                                "critical":  false
                                            },
                   "pbMsgFinalize":  {
                                         "ok":  true,
                                         "kind":  "func",
                                         "critical":  false
                                     },
                   "readConfigU64":  {
                                         "ok":  true,
                                         "kind":  "func",
                                         "critical":  false
                                     },
                   "pbMsgCleanup":  {
                                        "ok":  true,
                                        "kind":  "func",
                                        "critical":  false
                                    },
                   "getSection":  {
                                      "ok":  true,
                                      "kind":  "func",
                                      "critical":  false
                                  },
                   "kvFindKey":  {
                                     "ok":  true,
                                     "kind":  "func",
                                     "critical":  false
                                 },
                   "kvGetUint64":  {
                                       "ok":  true,
                                       "kind":  "func",
                                       "critical":  false
                                   },
                   "kvGetInt":  {
                                    "ok":  true,
                                    "kind":  "func",
                                    "critical":  false
                                },
                   "kvSetUint64":  {
                                       "ok":  true,
                                       "kind":  "func",
                                       "critical":  false
                                   },
                   "kvSetInt":  {
                                    "ok":  true,
                                    "kind":  "func",
                                    "critical":  false
                                },
                   "jobCurGlobal":  {
                                        "ok":  true,
                                        "kind":  "global",
                                        "critical":  false
                                    },
                   "refCountGlobal":  {
                                          "ok":  true,
                                          "kind":  "global",
                                          "critical":  false
                                      },
                   "ccmOffConnContext":  {
                                             "ok":  true,
                                             "kind":  "hardcoded",
                                             "critical":  false,
                                             "detail":  "validated on first use"
                                         },
                   "respWrapperVtable":  {
                                             "ok":  true,
                                             "kind":  "vtable",
                                             "critical":  false
                                         },
                   "engineOffJobMgr":  {
                                           "ok":  true,
                                           "kind":  "hardcoded",
                                           "critical":  false,
                                           "detail":  "validated on first use"